{
  "version":1,
  "revision":1,
  "status":"draft",
  "visibility":"author_only",
  "origin":"authored",
  "metadata":{"addition":true,"kind":"new_setting","note":"원작에 없는 동료 합류 전용 집필 이벤트 초고. 실제 합류 경로와 참조 장비가 확인된 경우에만 읽으며 본줄기 상태를 변경하지 않는다.","knowledge_policy":"author_reference_not_character_knowledge"},
  "policy":"join_gated_companion_scene_no_main_state_writes",
  "events":[
    {"id":"woodcutter_first_watch","companion_ref":{"catalog":"characters","id":"party_woodcutter"},"equipment_ref":{"catalog":"equipment","id":"story_axe"},"join_trigger":{"state":"party.members","value":"party_woodcutter","description":"첫 출발 경로에서 나무꾼이 현재 파티에 포함됨"},"chapter_id":"chapter01","unit_id":"chapter01/p05","title":[{"text":"나무꾼이 고른 첫 자리"}],"scene":[{"text":"성문을 나서기 전, 나무꾼은 일행의 뒤가 아니라 옆에 섰다. 등에 멘 벌목 도끼는 아직 한 번도 휘두르지 않았지만, 그는 손잡이를 고쳐 쥐며 길의 폭을 먼저 살폈다. 서진이 앞을 가리키자 나무꾼은 낮게 말했다. ‘길을 여는 일과 길을 지키는 일은 다릅니다. 저는 뒤를 보겠습니다.’ 그는 누구를 대신해 영웅이 되겠다고 하지 않았다. 다만 나뭇가지와 무너진 표식을 치우며, 모두가 돌아올 수 있는 길을 남기겠다고 했다."}],"role_reaction":[{"text":"벌목 도끼는 전투의 보상으로 바뀌지 않는다. 나무꾼은 길을 넓히는 손과 동료의 귀환을 확인하는 눈으로 먼저 기억된다."}],"follow_up":[{"text":"다음 야영에서 나무꾼은 가장 먼저 불침번 시간을 묻는다. 그가 합류한 경로에서만, 서진은 혼자 길의 뒤를 걱정하지 않아도 되는 순간을 경험한다."}],"main_state_writes":[],"origin":"authored","status":"proposed","metadata":{"addition":true,"kind":"new_setting","note":"나무꾼의 합류 직후 직업과 벌목 도끼를 드러내는 창작 장면이다.","knowledge_policy":"author_reference_not_character_knowledge"}},
    {"id":"hunter_first_sign","companion_ref":{"catalog":"characters","id":"party_hunter"},"equipment_ref":{"catalog":"equipment","id":"story_bow"},"join_trigger":{"state":"party.members","value":"party_hunter","description":"첫 출발 경로에서 사냥꾼이 현재 파티에 포함됨"},"chapter_id":"chapter01","unit_id":"chapter01/p05","title":[{"text":"사냥꾼이 읽은 발자국"}],"scene":[{"text":"사냥꾼은 성문을 지나자마자 땅을 보았다. 사냥 활의 줄을 확인한 뒤, 진흙에 남은 발자국과 바람에 눕혀진 풀을 번갈아 살폈다. ‘이건 적의 흔적이라고 말할 수는 없습니다. 다만 누군가 우리보다 먼저 이 길을 지나갔다는 건 알 수 있어요.’ 그는 확인한 것과 추측한 것을 나누어 말했다. 서진은 그 구분을 기억하며 길을 재촉하지 않았다. 사냥꾼은 앞서 달려가지 않고, 다음에 발을 놓을 자리를 조용히 가리켰다."}],"role_reaction":[{"text":"사냥 활은 특별한 능력을 약속하지 않는다. 사냥꾼의 전용 장면은 흔적을 확인하는 태도와, 모르는 것을 모른다고 남기는 습관을 보여 준다."}],"follow_up":[{"text":"동굴 입구에서 흔적이 끊겼을 때 사냥꾼은 성급히 결론 내리지 않는다. 합류한 경로에서만 서진은 그의 침묵이 망설임이 아니라 관찰임을 알아본다."}],"main_state_writes":[],"origin":"authored","status":"proposed","metadata":{"addition":true,"kind":"new_setting","note":"사냥꾼의 합류 직후 직업과 사냥 활을 드러내는 창작 장면이다.","knowledge_policy":"author_reference_not_character_knowledge"}},
    {"id":"cook_first_meal","companion_ref":{"catalog":"characters","id":"party_cook"},"equipment_ref":{"catalog":"equipment","id":"story_knife"},"join_trigger":{"state":"party.members","value":"party_cook","description":"첫 출발 경로에서 요리사가 현재 파티에 포함됨"},"chapter_id":"chapter01","unit_id":"chapter01/p05","title":[{"text":"요리사가 나눈 첫 끼니"}],"scene":[{"text":"요리사는 성문 밖 그늘에 앉자마자 주방 칼로 말린 빵을 자르지 않았다. 먼저 사람 수를 세고, 물이 남아 있는지 확인하고, 가장 늦게 먹을 사람의 몫을 따로 두었다. ‘배가 고픈 사람에게 먼저 주는 것과, 내일 먹을 몫을 남기는 건 다른 판단이에요.’ 그의 말은 잔소리처럼 들렸지만, 칼끝은 정확히 빵의 굳은 부분만 잘라 냈다. 서진은 작은 조각을 받아 들고, 동료가 합류한다는 것은 전투에 손 하나가 늘어나는 것만은 아니라고 생각했다."}],"role_reaction":[{"text":"주방 칼은 무기로 과장되지 않는다. 요리사는 식량의 양과 사람의 상태를 읽는 직업적 감각으로 파티 안의 생활을 만든다."}],"follow_up":[{"text":"첫 긴 이동 뒤 요리사는 남은 물을 보고 다음 휴식 시점을 제안한다. 그가 합류한 경로에서만 일행의 이동이 사람의 체력과 식사까지 포함한 계획으로 바뀐다."}],"main_state_writes":[],"origin":"authored","status":"proposed","metadata":{"addition":true,"kind":"new_setting","note":"요리사의 합류 직후 직업과 주방 칼을 드러내는 창작 장면이다.","knowledge_policy":"author_reference_not_character_knowledge"}},
    {"id":"magician_first_light","companion_ref":{"catalog":"characters","id":"party_magician"},"equipment_ref":{"catalog":"equipment","id":"story_wand"},"join_trigger":{"state":"party.members","value":"party_magician","description":"첫 출발 경로에서 마술사가 현재 파티에 포함됨"},"chapter_id":"chapter01","unit_id":"chapter01/p05","title":[{"text":"마술사가 감춘 불빛"}],"scene":[{"text":"마술사는 성문을 나선 뒤 지팡이를 높이 들지 않았다. 대신 손바닥만 한 불빛을 돌 틈 아래에 비추고는 곧바로 거두었다. ‘보이는 것을 늘리면, 우리도 더 잘 보입니다.’ 그는 빛을 만들었다고 자랑하지 않고 필요한 만큼만 사용했다. 서진이 왜 숨겼느냐고 묻자 마술사는 어깨를 으쓱했다. ‘마술은 보여 주는 일보다, 언제 보이지 않게 할지를 정하는 일이 더 어렵습니다.’ 그 말은 새로운 힘의 약속이 아니라 함께 이동하는 사람이 지켜야 할 절제에 가까웠다."}],"role_reaction":[{"text":"마술사의 지팡이는 새로운 주문이나 원작에 없는 효과를 만들지 않는다. 전용 장면은 힘의 사용보다 조건과 절제를 다룬다."}],"follow_up":[{"text":"동굴에서 작은 빛이 필요해졌을 때 마술사는 먼저 모두의 위치를 묻는다. 합류한 경로에서만 일행은 그가 혼자 빛을 독점하지 않는다는 사실을 행동으로 확인한다."}],"main_state_writes":[],"origin":"authored","status":"proposed","metadata":{"addition":true,"kind":"new_setting","note":"마술사의 합류 직후 직업과 story_wand를 드러내는 창작 장면이다.","knowledge_policy":"author_reference_not_character_knowledge"}},
    {"id":"skeleton_first_name","companion_ref":{"catalog":"characters","id":"skeleton"},"equipment_ref":null,"join_trigger":{"state":"party.optional","value":"skeleton","description":"성문에서 합류를 수락하고 선택 동료 슬롯에 스켈레톤이 실제로 들어옴"},"chapter_id":"chapter01","unit_id":"chapter01/p05","title":[{"text":"스켈레톤이 고른 이름"}],"scene":[{"text":"스켈레톤은 대열에 들어온 뒤 자신의 이름을 먼저 말하지 않았다. 뼈마디가 움직일 때마다 나는 마른 소리를 듣고, 서진은 그가 말할 수 있는지조차 확신하지 못했다. 잠시 뒤 스켈레톤은 길가의 부러진 표지를 가리켰다. 이름이 적혀 있던 나무판이었다. 서진이 ‘당신을 어떻게 부르면 되지?’라고 묻자, 스켈레톤은 표지의 남은 글자를 손끝으로 쓸어 내렸다. 완전한 이름은 읽히지 않았다. 일행은 빈칸을 멋대로 채우지 않고, 그가 고개를 끄덕인 짧은 호칭으로 부르기로 했다. 합류는 과거를 알아냈다는 뜻이 아니라, 앞으로 함께 걸을 수 있다는 확인이었다."}],"role_reaction":[{"text":"스켈레톤의 전용 장면은 정체나 과거를 확정하지 않는다. 선택 동료가 실제 파티에 들어온 경로에서만, 말하지 않은 정보와 현재의 동행을 구분한다."}],"follow_up":[{"text":"이후 일행이 이름을 묻는 순간, 스켈레톤이 직접 보인 반응만 기억된다. 영입하지 않은 경로에서는 이 호칭이나 기억을 만들지 않는다."}],"main_state_writes":[],"origin":"authored","status":"proposed","metadata":{"addition":true,"kind":"new_setting","note":"선택 동료 스켈레톤의 실제 합류 뒤에만 열리는 창작 장면이다. 정체·과거·능력은 확정하지 않는다.","knowledge_policy":"author_reference_not_character_knowledge"}},
    {"id":"spica_first_lesson","companion_ref":{"catalog":"characters","id":"spica"},"equipment_ref":null,"join_trigger":{"state":"party.optional","value":"spica","description":"미로에서 합류를 수락하고 스피카가 현재 파티에 실제로 들어옴"},"chapter_id":"chapter07","unit_id":"chapter07/p03","title":[{"text":"스피카가 정한 첫 수업"}],"scene":[{"text":"스피카는 동료가 되었다고 해서 곧바로 새로운 능력을 보여 주지 않았다. 미로의 바닥에 작은 돌 세 개를 놓고, 일행에게 어느 돌이 가장 안전해 보이는지 물었다. 나무꾼은 무게를, 사냥꾼은 주변 흔적을, 요리사는 돌에 묻은 가루를, 마술사는 빛이 꺾이는 각도를 살폈다. 스피카는 누구의 답도 바로 맞다고 하지 않았다. ‘능력은 혼자 쓰는 기술이 아니라, 다른 사람의 관찰과 맞물릴 때 비로소 길이 됩니다.’ 그날의 첫 수업은 주문이 아니라 서로의 판단을 기다리는 일이었다."}],"role_reaction":[{"text":"스피카의 전용 장면은 다섯 능력의 효과를 새로 만들지 않는다. 기존 설명과 경고를 대체하지 않고, 합류 후 동료들의 관찰을 연결하는 창작 초고다."}],"follow_up":[{"text":"다음 미로에서 스피카가 질문을 던지면, 합류한 동료가 있는 경로마다 답이 달라진다. 스피카가 합류하지 않은 경로에서는 이 수업을 들은 사람이 없으므로 반응도 없다."}],"main_state_writes":[],"origin":"authored","status":"proposed","metadata":{"addition":true,"kind":"new_setting","note":"선택 동료 스피카의 실제 합류 뒤에만 열리는 창작 장면이다. 원작 능력의 효과·조건·진상을 추가하지 않는다.","knowledge_policy":"author_reference_not_character_knowledge"}}
  ]
}
